Title,Price,Company,Link
"Refurbished Latitude 5280 5285 5290 7275 2in1Laptopfor
						Dell","US$5,000","Shen Zhen Li Kong Technology Co., Ltd.",https://www.alibaba.com/product-detail/Refurbished-Latitude-5280-5285-5290-7275_1600207262501.html
Best Seller Full Flat Front Panel IP65 Grade protectionLaptopIn-tel Core I7-8565U Tablet Pc,US$779,"Yanling Industrial Computer Technology (shenzhen) Co., Ltd.",https://www.alibaba.com/product-detail/Best-Seller-Full-Flat-Front-Panel_1600995792474.html
"Intel Core I9-10885HLaptopsI9 16 Inch Touch Screen 64GB
						RAM 4TB SSD GamingLaptopDual ScreenLaptop",US$113.58-US$178.62,"ABELOE (HK) TECHNOLOGY CO., LIMITED",https://www.alibaba.com/product-detail/Intel-Core-I9-10885H-Laptops-I9_11000021001671.html
"TwinscaseLaptopH Custom Notebook GamingLaptopBrand New Offer Cheap Workstation BusinessLaptopLow Price All in One
						Computer",US$345-US$417,"Shenzhen Twins Metal & Plastic Product Co ., Ltd.",https://www.alibaba.com/product-detail/Twinscase-Laptop-H-Custom-Notebook-Gaming_1601202149281.html
"I7 Core 11th 12th GenLaptopComputer 16gb Ram 11 10th
						Generation 1tb Ssd 8gb 15.6 Inch Intel NotebookLaptopI7",US$115-US$500,"Shenzhen Itzr Technology Co., Ltd.",https://www.alibaba.com/product-detail/I7-Core-11th-12th-Gen-Laptop_1601044751898.html
"Touch Screen UsedLaptopfor Dell Latitude 7400 I7-8665U
						16GB 256GB Win10 14"" InchLaptopA+Renovation Wholesale BusinessLaptop",US$221.29-US$241.29,HongKong Mercury International Trading Company Limited,https://www.alibaba.com/product-detail/Touch-Screen-Used-Laptop-for-Dell_1601290646477.html
"Laptopfor Students Portable Mini Notebook 11.6 Inch IPS
						Touch ScreenLaptopsWith 512GB SSD Intel N4020 Gaming Computer",US$165.80-US$182,"Shenzhen Peideluo E-Commerce Co., Ltd.",https://www.alibaba.com/product-detail/Laptop-for-Students-Portable-Mini-Notebook_1601224979491.html
Fast Shipping NewLaptop8gb Oem Cheap NotebookLaptop14inch 8GBRAMLaptopfor Kids Ordinateur Portable 512GB SS,US$178,"Shenzhen Greenwell Technology Co., Ltd.",https://www.alibaba.com/product-detail/Fast-Shipping-New-Laptop-8gb-Oem_1601114943570.html
"Notebook ComputerLaptops15.6 Inch 1920*1080P Intel
						N5095 16GB RAM 256GB SSD GamingLaptopsfor StudentLaptops",US$178,Shenzhen Xingzegao Electronics Ltd.,https://www.alibaba.com/product-detail/Notebook-Computer-Laptops-15-6-Inch_1601386786745.html
"The CheapestLaptopfor Students Office N4000/N5095
						I3/i5/i7 14/15.6 Inches High QualityLaptop",US$100-US$114,Junsha International Holdings Limited,https://www.alibaba.com/product-detail/The-Cheapest-Laptop-for-Students-Office_1601371882363.html
"14.1 Inch Win 11Laptop16g Ram 256g/512g/1t Rom 1920x
						1200 Touch Screen 4500mah BatteryLaptopTablet",US$239-US$279,"Shenzhen CWHT Technology Co., Ltd.",https://www.alibaba.com/product-detail/14-1-Inch-Win-11-Laptop_1601350229310.html
"15.6\"" BusinessLaptopIntel Processors Custom Portable
						Metal English DDR4 256GB 512GB 128GB 2TB WiFi 1TB 7 Inch",US$243.89-US$357.51,"Yijin Intelligent Technology (shenzhen) Co., Ltd.",https://www.alibaba.com/product-detail/15-6-Business-Laptop-Intel-Processors_1601297004884.html
"High Quality ThinkPad T480 Core I3 I5 I7 CPU 8th Gen 14 Inch
						PortableLaptopsBarebone",US$150-US$280,"Shanghai Qiyu Education Technology Co., Ltd.",https://www.alibaba.com/product-detail/High-Quality-ThinkPad-T480-Core-I3_1601379631330.html
"Bestselling Lightweight Commercial OfficeLaptopsHome
						StudentLaptops, and Learning Computers I3-1005G1 8G 256G HP 256 G8",US$271-US$281,"Beijing Gaotai Shengye Technology Co., Ltd.",https://www.alibaba.com/product-detail/Bestselling-Lightweight-Commercial-Office-Laptops-Home_1601417293228.html
"ThinkpadLaptopL480 Core I5 8th Gen 8GB RAM 256GBSSD
						Business OfficeLaptopComputer","US$1,177-US$1,496","Chongqing Dolan Trading Co., Ltd.",https://www.alibaba.com/product-detail/Thinkpad-Laptop-L480-Core-I5-8th_1601270294466.html
"OEM 10.1 Inch Touch Screen Android MiniLaptopVIKUSHA
						4GB+64GB Tablet PC 2 in 1Laptopfor Business",US$103,"Shenzhen City Honglixinda Electron Co., Ltd.",https://www.alibaba.com/product-detail/OEM-10-1-Inch-Touch-Screen_1600601852030.html
"ODM OEM Gaming Computer NotebookLaptopRtx 4090 Gaming
						Intel CPU I9 13900H I7 13700H 64GB RAM 1T 2T 8T SSD 2.5K Display","US$973-US$1,032","Shenzhen T.d.s Electronic Technology Co., Limited",https://www.alibaba.com/product-detail/ODM-OEM-Gaming-Computer-Notebook-Laptop_1601335154715.html
"Best Price New 10.1 Inch Mini Notebook Factory Direct Sales
						Quad Core Allwiner A133 AndroidLaptopfor Business and Learning",US$70,"Shenzhen Honlin Technology Co., Ltd.",https://www.alibaba.com/product-detail/Best-Price-New-10-1-Inch_1600859641475.html
Factory Price17.3 InchLaptopCore I7LaptopNotebook Computer 17 Inch Full HD GamingLaptopComputer,US$755.27-US$870.59,"Shenzhen Shoulder Hong Renju Technology Co., Ltd.",https://www.alibaba.com/product-detail/Factory-Price17-3-Inch-Laptop-Core_1601429919470.html
"DW-L3 Basic Version OfLaptopColor Doppler Ultrasound
						Scanner","US$2,199-US$5,299","Dawei Medical (Jiangsu) Co., Ltd.",https://www.alibaba.com/product-detail/DW-L3-Basic-Version-Of-Laptop_1601443132241.html?s=p
Pc Computer N100Laptop8 Inch Mini ScreenLaptopsBusinessLaptops,US$315,"Shenzhen Hstar Technology Co., Ltd.",https://www.alibaba.com/product-detail/Pc-Computer-N100-Laptop-8-Inch_1601085269138.html
"15.6"" the Latest Dual Screen Ultra SlimLaptopsBrand
						New Notebook N95 2.9Ghz 32Gb Ram Ssd Multi-Purpose Device BusinessLaptop",US$197-US$235,"Shenzhen Skyblue Technology Co., Ltd.",https://www.alibaba.com/product-detail/15-6-the-Latest-Dual-Screen_1601249850534.html
Gadgets Electronic New Arrival Reasonable Price BusinessLaptopsNotebook 15.6 Inch + 7 Inch Double ScreenLaptop,US$199-US$265,Guangzhou Zidian Technology Limited,https://www.alibaba.com/product-detail/Gadgets-Electronic-New-Arrival-Reasonable-Price_1601049895181.html
"HL160GT Factory Direct 16-inch Portable Business Office &
						GameLaptopwith Intel I7 SSD Intel Graphics N95,N5095",US$189-US$388,"Guangzhou Allison Technology Co., Ltd.",https://www.alibaba.com/product-detail/HL160GT-Factory-Direct-16-inch-Portable_1601377992477.html
"High Quality Quad Core N3350 8GB Ram 128GB 256GB 512GB SSD 14
						InchLaptopComputer Gaming Ordinateur PortableLaptops",US$99.80,"Jingjiang Gisen Technology Co., Ltd.",https://www.alibaba.com/product-detail/High-Quality-Quad-Core-N3350-8GB_1601342576269.html
"Touch ScreenLaptop14 Inch Yoga 360 Degree Rotating
						Business Computer Intel N95 DDR4 8G 16G 32GRAM+128G 256G 512G 1TB 2TB SSD",US$195-US$327,"Shenzhen Jingchuang Guodu Technology Co., Ltd.",https://www.alibaba.com/product-detail/Touch-Screen-Laptop-14-Inch-Yoga_1601421041057.html
"H-onor Magicbook X16 PRO 2024, 13th Gen Intel Core I5-13420h
						16GB/512GB, 16-InchLaptop",US$539,"Wuhan Xinqidian Technology Group Co., Ltd.",https://www.alibaba.com/product-detail/H-onor-Magicbook-X16-PRO-2024_1601218819981.html
"2025 15.6-Inch SlimLaptopIntel N4000 8GB RAM 128GB SSD
						Bluetooth English Plastic Notebook Computer Cheap Stock Available",US$108,"Shenzhen Bestviewtech Electronics Co., Ltd.",https://www.alibaba.com/product-detail/2025-15-6-Inch-Slim-Laptop_60824131502.html
"GamingLaptopDual-Monitor I9Laptop16 Inch
						Touch Screen 64GB RAM 4TB SSD Intel Core I9-10885HLaptops",US$511-US$792,"Shenzhen Anxin Taihe Technology Co., Ltd.",https://www.alibaba.com/product-detail/Gaming-Laptop-Dual-Monitor-I9-Laptop_1600790782019.html
"HP Zbook Studio G9 Intel Core I7 I9 12th Gen RTX A1000 A2000
						A3000 A4500 16"" Mobile WorkstationLaptop","US$2,099-US$5,099","Beijing Boyuan Weiye Technology Co., Ltd.",https://www.alibaba.com/product-detail/HP-Zbook-Studio-G9-Intel-Core_1600895943582.html
"Elitebook 640G10 Business OfficeLaptop14
						Inch/Commercial/Mainstream/Hot Sale/OfficeLaptop",US$620-US$720,"Beijing Guangtian Runze Technology Co., Ltd.",https://www.alibaba.com/product-detail/Elitebook-640G10-Business-Office-Laptop-14_1600934027279.html
"FTL-UTS90 Notebook Color Doppler Portable Best Price Color
						DopplerLaptopUltrasound Machine Medical Imaging For Animal","US$1,300-US$1,600","Fatali Medical Technology (foshan) Co., Ltd.",https://www.alibaba.com/product-detail/FTL-UTS90-Notebook-Color-Doppler-Portable_1601305170014.html?s=p
"New Design 15.6'' Intel Notebook N5095 Win11LaptopComputer China Factory Cheap GamingLaptopComputersLaptopsand
						Desktops",US$168-US$235,"HK L&P TECHNOLOGY CO., LIMITED",https://www.alibaba.com/product-detail/New-Design-15-6-Intel-Notebook_1601011523824.html
"1 95% NewLaptopProBook 650 G4 Intel Core I5-7th 8GB
						256GB SSD 15.6 ""businessLaptop",US$190,"Guangzhou Youchuangyi E-Commerce Co., Ltd.",https://www.alibaba.com/product-detail/1-95-New-Laptop-ProBook-650_1601062496168.html
"2024 NewLaptopI7 Core 1165G7 11th 15.6 Computer
						Original Computadoras PortatilLaptopsNetbook With Win 10 11",US$351-US$414,"Shenzhen Shuwei Technology Co., Limited",https://www.alibaba.com/product-detail/2024-New-Laptop-I7-Core-1165G7_1600291300115.html
"Lightweight Win-10 Intel I5 Notebook High-Definition Screen
						EnterpriseLaptopComputer for Students",US$168,"Guangzhou City Tianhe District Shipai Changle Digital Products Management
				Department",https://www.alibaba.com/product-detail/Lightweight-Win-10-Intel-I5-Notebook_1601243480618.html
Factory Cheap 15.6'' Intel Notebook N5095 Win11LaptopComputer Quad up to 2.9 GamingLaptopComputers,US$188,"Shenzhen DreamQ Technology Development Co., Ltd.",https://www.alibaba.com/product-detail/Factory-Cheap-15-6-Intel-Notebook_1600986482499.html
Wholesale 1920x1080 Ips BusinessLaptopsPc PortableLaptopCore I7/ N100 11 Generation Dual Touch ScreenLaptop,US$279,"Shenzhen Gst Communication Co., Ltd",https://www.alibaba.com/product-detail/Wholesale-1920x1080-Ips-Business-Laptops-Pc_1601076474556.html
"Brand New BusinessLaptopsCore I7-1060NG7 Custom Logo
						GamingLaptopSupport OEM",US$260-US$350,"Beijing Guangshengying Import And Export Co., Ltd.",https://www.alibaba.com/product-detail/Brand-New-Business-Laptops-Core-I7_1601320040099.html
"2024 Cheap Brand New 15.6 Inch Intel Celeron J4105 Notebook PC
						DDR4 8GB 12GB Ram 512G 1000GB SSD Oem Home School BusinessLaptop",US$174-US$210,"Shenzhen Weiboer Digital Co., Ltd.",https://www.alibaba.com/product-detail/2024-Cheap-Brand-New-15-6_1600108515076.html
"15.6 Inch 10th I7 Core 1060NG7 BusinessLaptopWith
						8/16/32GB RAM and 512G/1/2TB SSD Options Win 10",US$289-US$346,"Hanxuanmo (tianjin) Technology Development Co., Ltd.",https://www.alibaba.com/product-detail/15-6-Inch-10th-I7-Core_1601266644197.html
"wholesale ready to ship 840G3 intel core i5 6gen 8GB ram 512G
						ssd 14inch businesslaptopfor Personal use",US$128-US$131,HK YUDO TECH. LIMITED,https://www.alibaba.com/product-detail/wholesale-ready-to-ship-840G3-intel_1601384018249.html
"16 Inch Dual Screen Touch ScreenLaptopNotebook
						Computer Core I7 16GB RAM 512GB SSD Business PersonalLaptops",US$499-US$614,"Shenzhen BQKK Technology Co., LTD.",https://www.alibaba.com/product-detail/16-Inch-Dual-Screen-Touch-Screen_1601206051669.html
"17.3""LaptopsBrand New Intel N5095 DDR4 16+1TB SSD Home
						School BusinessLaptopsPortable PC Big Screen GamingLaptopComputer",US$199-US$306,"Shenzhen Carevery Technology Co., Ltd.",https://www.alibaba.com/product-detail/17-3-Laptops-Brand-New-Intel_1601238967158.html
"Factory 2025 New Ultrabook 14.1 Inch Foldable Dual Touch Screen
						Intel 13th N100 Aluminum YogaLaptopsfor Students and Designers",US$281.50-US$454,"Shenzhen Broadstarry Technology Co., Ltd.",https://www.alibaba.com/product-detail/Factory-2025-New-Ultrabook-14-1_1600978418927.html
"14 InchLaptopsCore N3350 2.4Ghz 6GB RAM 64GB ROM
						Notbook Pc Computer Personal Home CheapLaptopWin 10 PRO",US$97,Shenzhen South Digital Limited,https://www.alibaba.com/product-detail/14-Inch-Laptops-Core-N3350-2_1601073481933.html
"4 Inch Win 11 Brand New NotebookLaptop8gb 1 Tb 14
						Inches",US$240,"Xiamen Clarence Technology Co., Ltd.",https://www.alibaba.com/product-detail/4-Inch-Win-11-Brand-New_1601025090362.html
"Cheaper Brand New 15.6 Inch N5095 BusinessLaptops16Gb
						24Gb Ram Computer Notebooks Pink for BusinessLaptopI9 11th Generation",US$115-US$130,"Shenzhen Great I-Del Technology Co., Ltd.",https://www.alibaba.com/product-detail/Cheaper-Brand-New-15-6-Inch_1601147602462.html
Dell New I5-1334U Inspiron 15 8GB 256GB Windows 11Laptop15.6 Inch High ResolutionLaptopComputer Hardware,US$190-US$520,"Xiamen Dongchengxing Information Technology Co., Ltd.",https://www.alibaba.com/product-detail/Dell-New-I5-1334U-Inspiron-15_1601248007542.html
"Brand New Factory Bulk Wholesale 14inch Cheap Win10 N4000 6G RAM
						128GB/256GB/512GB/1TB SSD LearningLaptops",US$92-US$153,"Qu Workshop (Shenzhen) Technology Co., Ltd.",https://www.alibaba.com/product-detail/Brand-New-Factory-Bulk-Wholesale-14inch_1601044337258.html
"A+ Grade Touch ScreenLaptopCore I7 I5 8gen Business
						Notebook UsedLaptopsfor Hp X360 1030g3 Original Refurbished Computer",US$246-US$349,"Shenzhen Fuli Technology Co., Ltd.",https://www.alibaba.com/product-detail/A-Grade-Touch-Screen-Laptop-Core_1601049444623.html
15.6 Inch Intel Core I7 8gb Ram 128gb 256gb 512gb Ssd Win10LaptopGaming Computer for Home School Business Notebook,US$180-US$270,"Shenzhen Itzr Technology Co., Ltd.",https://www.alibaba.com/product-detail/15-6-Inch-Intel-Core-I7_1600506263835.html
"Wholesale HandLaptopElitebook 850 G6 I5-8665U 8GB Ram
						256GB SSD UsedLaptopfor HP 14"" Computer Notebook PC",US$215.20-US$228.43,HongKong Mercury International Trading Company Limited,https://www.alibaba.com/product-detail/Wholesale-Hand-Laptop-Elitebook-850-G6_1601291900396.html
"Twinscase Computer Accessories Custom Notebook GamingLaptopBrand New Student Offer Cheap Workstation BusinessLaptopLow
						Price",US$345-US$417,"Shenzhen Twins Metal & Plastic Product Co., Ltd.",https://www.alibaba.com/product-detail/Twinscase-Computer-Accessories-Custom-Notebook-Gaming_1601206894687.html
New 15.6 Inch Slim Intel N5095 Processor CheapLaptopSlimLaptopfor Home Use,US$198,"Shenzhen Greenwell Technology Co., Ltd.",https://www.alibaba.com/product-detail/New-15-6-Inch-Slim-Intel_1600158706792.html
"High Quality OEM NotebookLaptop15.6 Inch 16GB+512GB I5
						I7 I9 New OEM for Educational Business and Home",US$178,Shenzhen Xingzegao Electronics Ltd.,https://www.alibaba.com/product-detail/High-Quality-OEM-Notebook-Laptop-15_1600243909470.html
High Performance 15.6 Inch FHD All in One PortableLaptopIntel N5095 N4000 DDR4 16GB SSD 256GB 512GB Personal & HomeLaptops,US$112-US$146,Junsha International Holdings Limited,https://www.alibaba.com/product-detail/High-Performance-15-6-Inch-FHD_1601399437493.html
"Hot-Selling 15.6'' SlimLaptopwith 8GB RAM 512GB SSD
						Intel Celeron Processor Intel Graphics for Learning Office Home Use Stock!",US$152,"Shenzhen Aiopc Digital Communication Co., Limited",https://www.alibaba.com/product-detail/Hot-Selling-15-6-Slim-Laptop_1601421054450.html
10.5-Inch Dual Screen Touchscreen Gaming & BusinessLaptopIntel Processor New & English Keyboard 1TB 2TB SSD Metal Body,US$266.05-US$378.52,"Yijin Intelligent Technology (shenzhen) Co., Ltd.",https://www.alibaba.com/product-detail/10-5-Inch-Dual-Screen-Touchscreen_1601213936966.html
"High Quality ThinkPad T450 Core I5 I7 CPU 5th Gen 14 Inch
						PortableLaptopsBarebone",US$100-US$240,"Shanghai Qiyu Education Technology Co., Ltd.",https://www.alibaba.com/product-detail/High-Quality-ThinkPad-T450-Core-I5_1601424478910.html
"Customized 14 InchLaptopsWin10 Computer Portatil 6GB
						RAM 128GBROM 1366*768 9000mA Hardware Notebook Portable PC Computer",US$86.50-US$98,"Shenzhen Shengle Digital Technology Co., Ltd.",https://www.alibaba.com/product-detail/Customized-14-Inch-Laptops-Win10-Computer_1600406273233.html
"Wholesale ComputerLaptopMsis Lenovos HPs Asuss
						Business GamingLaptop","US$1,177-US$1,496","Chongqing Dolan Trading Co., Ltd.",https://www.alibaba.com/product-detail/Wholesale-Computer-Laptop-Msis-Lenovos-HPs_1601384282815.html
Laptopfor Students Factory WholesaleLaptopsWith Large Capacity 32GB+1TB for Business,US$228-US$274.80,"Shenzhen Peideluo E-Commerce Co., Ltd.",https://www.alibaba.com/product-detail/Laptop-for-Students-Factory-Wholesale-Laptops_1601246773893.html
"Cheap15.6 Inch IPS 1920*1080LaptopNotebook Computer
						Win10 Intel N5095 Business Office Learning Gaming Portable PcLaptops",US$150-US$165,"Shenzhen T.d.s Electronic Technology Co., Limited",https://www.alibaba.com/product-detail/Cheap15-6-Inch-IPS-1920-1080_1600790774077.html
"10.1 Inch Android 12.0 GreenLaptopAllwinner A133 Quad
						Core 2GB RAM 64GB Storage Student and Educational SlimLaptop",US$63,"Shenzhen Honlin Technology Co., Ltd.",https://www.alibaba.com/product-detail/10-1-Inch-Android-12-0_1601226656283.html
"16.1 Inch GamingLaptopCore I9 10885H I7-10750H Nvi-da
						GTX 1650 4G IPS 1920x1080 144Hz Ultrabook Win11 Gamer Notebook Computer",US$530-US$660,"Huizhou S-Xin Electronic Technology Co., Ltd.",https://www.alibaba.com/product-detail/16-1-Inch-Gaming-Laptop-Core_1600878195753.html
"The Latest Dual ScreenLaptopsBrand New Notebook N100
						2.0Ghz 16Gb 32Gb Ram 512GB 1Tb Ssd Multi-Purpose Device BusinessLaptop",US$217-US$231,"ABELOE (HK) TECHNOLOGY CO., LIMITED",https://www.alibaba.com/product-detail/The-Latest-Dual-Screen-Laptops-Brand_1601411669972.html
"Brand New Dual ScreenLaptop15.6 Inch and 7 Inch Touch
						Screen Intel N95 Double Display 16GB 1TB SSD for Gaming Business Office",US$220-US$299,"Chengdu Fibe Technology Service Co., Ltd.",https://www.alibaba.com/product-detail/Brand-New-Dual-Screen-Laptop-15_1601168477372.html
14 Inch Unlock Fingerprint Optional Touch Screen Industrial PcLaptopComputer I7 Rugged Notebook,"US$1,960",Shenzhen Swell Qiye Technology Company Limited,https://www.alibaba.com/product-detail/14-Inch-Unlock-Fingerprint-Optional-Touch_62258697933.html
"Dual Screen 15.6-Inch+ 7-Inch Touch 1TB SSD Intel Celeron N100
						Processor 128GB 256GB 512GB Options New BusinessLaptop",US$218-US$291,"Guangzhou Allison Technology Co., Ltd.",https://www.alibaba.com/product-detail/Dual-Screen-15-6-Inch-7_1601347000954.html
2024 NEW Suitable for Office and Daily Use 10.1 InchLaptopsCheap 10.1 Inch 4GB 128GB A133 CPU Ultra Mini Portable Computer,US$76.80,"Jingjiang Gisen Technology Co., Ltd.",https://www.alibaba.com/product-detail/2024-NEW-Suitable-for-Office-and_1601241690197.html
Wholesale Custom AZERTY Keyboard Dual ScreenLaptopTouch Screen 15.6+7 Inch Computer Student I7 I9 13thN100 BusinessLaptop,US$180-US$315,"Shenzhen Jingchuang Guodu Technology Co., Ltd.",https://www.alibaba.com/product-detail/Wholesale-Custom-AZERTY-Keyboard-Dual-Screen_1601329270279.html
"Core I7 11th GenLaptopComputer 16GB RAM 11 10th
						Generation 1TB SSD 8GB 15.6 Inch Intel NotebookLaptopI7",US$290-US$380,"Shenzhen Voche Electronics Technology Co., Ltd.",https://www.alibaba.com/product-detail/Core-I7-11th-Gen-Laptop-Computer_1600874037824.html
"I7 Core 11th 12thLaptopComputer 16GB RAM 11 10th
						Generation 1TB SSD 8GB 15.6 Inch Intel NotebookLaptopI7",US$512.64-US$639.04,"Jinan Guanshun Electronic Technology Co., Ltd",https://www.alibaba.com/product-detail/I7-Core-11th-12th-Laptop-Computer_1601250556800.html
"Core I9Laptop32GB RAM 16GB RAM Computer I9-10885H
						Touchscreen Dual Screen Notebook PC",US$588,"Shenzhen Anxin Taihe Technology Co., Ltd.",https://www.alibaba.com/product-detail/Core-I9-Laptop-32GB-RAM-16GB_1600583667339.html
"Rotating Portable Dual Touch Screen 14inch +16inch 2K QHD
						Hexa-Core I7 Gamer Notebook Computer Pc Business Cheap GamingLaptop",US$129-US$534,"Shenzhen Hopestar Sci-Tech Co., Ltd.",https://www.alibaba.com/product-detail/Rotating-Portable-Dual-Touch-Screen-14inch_1601246765233.html
"19 ""LaptopCore I3 I5 I7 Led Aio Cheap DesktopLaptopComputer Monoblock Barebone All in One Pc for Office Gaming",US$100.94-US$161.70,"Shenzhen XRH Sci-Tech Co., Ltd.",https://www.alibaba.com/product-detail/19-Laptop-Core-I3-I5-I7_1601283994270.html
"LaptopsBrand New Fingerprint 15.6inch Intel Core I7
						1165G7 I7 1185G7 11th 10th 9th Generation 16GB 32GB Business GameLaptop",US$348-US$518,"HK L&P TECHNOLOGY CO., LIMITED",https://www.alibaba.com/product-detail/Laptops-Brand-New-Fingerprint-15-6inch_1601011638115.html
"High Quality Original 95% NewLaptopSuitable for Dell
						Latitude 5550 I5-5th 8G Ram 256G Business 15.6-inchLaptopLaptop",US$130,"Guangzhou Youchuangyi E-Commerce Co., Ltd.",https://www.alibaba.com/product-detail/High-Quality-Original-95-New-Laptop_1600955344352.html
"NewLaptopComputer 1920*1080LaptopsCheap Core
						15.6Inch Student & EducationLaptopWith Fingerprint Backlight",US$128-US$154,"Shenzhen Vitek Electronics Co., Ltd.",https://www.alibaba.com/product-detail/New-Laptop-Computer-1920-1080-Laptops_1601048861699.html
95 New Elitebook 840 G5 I7-8th 8GB Memory UsedLaptopWin10 14 Inch UsedLaptopPortable Business Computer,US$195,"Guangzhou City Tianhe District Shipai Changle Digital Products Management
				Department",https://www.alibaba.com/product-detail/95-New-Elitebook-840-G5-I7_1601250378073.html
"Hot 14.1-Inch LaptopN400012th Generation with 128GB 256GB 512GB
						SSD for Home & Student Use As Personal Notebook",US$150-US$185,"Shenzhen Huashengtai Technology Co., Ltd.",https://www.alibaba.com/product-detail/Hot-14-1-Inch-LaptopN400012th-Generation_1601028603418.html
"Win11 16inch Dual Screen BusinessLaptopComputer 14inch
						Touch Screen 32GB SSD 1TBLaptopfor Video Editing",US$534.10,"Shenzhen Gst Communication Co., Ltd",https://www.alibaba.com/product-detail/Win11-16inch-Dual-Screen-Business-Laptop_1601395136823.html
2025 New 14 Inch Touch Screen 2-in-1 Business & GamingLaptopOEM Factory's Student-friendly Notebook Tablet Multifunctionality,US$210-US$250,"Beijing Guangshengying Import And Export Co., Ltd.",https://www.alibaba.com/product-detail/2025-New-14-Inch-Touch-Screen_1601222702250.html
"New 16.1 Inch Intel Core I9 10885H Gamer PC GTX1650 RTX4060
						Graphics Card Core I5 I9 12th 10th Gen 64GB Business GamingLaptop","US$679-US$1,014","Shenzhen Weiboer Digital Co., Ltd.",https://www.alibaba.com/product-detail/New-16-1-Inch-Intel-Core_1600455362110.html
"2025 Hot New Slim 14-inch BusinessLaptopwith Intel
						N4000 128Gb & 1TB Win 10 for Students",US$109-US$153,"Hanxuanmo (tianjin) Technology Development Co., Ltd.",https://www.alibaba.com/product-detail/2025-Hot-New-Slim-14-inch_1601268125797.html
"14 InchLaptopsWindow 10 Dual Core Intel Celeron N3350
						Notebook 6GB RAM 64 GB ROM Latop Computer",US$98-US$103,"Shenzhen Kowe Direct Co., Limited",https://www.alibaba.com/product-detail/14-Inch-Laptops-Window-10-Dual_1600798900549.html
"OEM DetachableLaptops2-in-1LaptopTouchscreen
						Win 11 14inch Notebook Computer for Office Work NetbookLaptops",US$269,"Shenzhen BQKK Technology Co., LTD.",https://www.alibaba.com/product-detail/OEM-Detachable-Laptops-2-in-1_1601020512555.html
"2024 Hot Sales 2 in 1 2.5K Double Touch Screen 13.5""LaptopsBrand New 16+1TB 9000 Battery Notebook BusinessLaptopsComputer",US$359-US$419,"Shenzhen Carevery Technology Co., Ltd.",https://www.alibaba.com/product-detail/2024-Hot-Sales-2-in-1_1601005398417.html
Newlaptopportable lightweight business office gaminglaptopwholesalelaptop,US$198.50-US$254.20,"Shenzhen Jiangyuan Microelectronics Technology Co., Ltd.",https://www.alibaba.com/product-detail/New-laptop-portable-lightweight-business-office_1601013199919.html
"LaptopBrand New AMD R7 GamingLaptopPC 15.9
						Inch FHD 2.5K 16GB 32GB DDR5 512GB SSD Portable Notebook English Keyboard US Plug",US$287-US$405,Shenzhen South Digital Limited,https://www.alibaba.com/product-detail/Laptop-Brand-New-AMD-R7-Gaming_1601254218665.html
Laptop8gb 1 Tb 14 Inches,US$300,"Xiamen Clarence Technology Co., Ltd.",https://www.alibaba.com/product-detail/Laptop-8gb-1-Tb-14-Inches_1601023475208.html
"2024 New Style 16-inch 2-in-1 TabletLaptopPortable
						Business Office LearningLaptopWith With Keyboard",US$220-US$450,ZHIGUANG HK INDUSTRY LIMITED,https://www.alibaba.com/product-detail/2024-New-Style-16-inch-2_1601258138552.html
"15.6 InchLaptopIntel Core I7 Processor I7-4578U 16GB
						RAM 512GB SSD Win 10 OS English Keyboard Premium NotebookLaptopComputer",US$219-US$239,"Shenzhen YEPO Time Electronics Co., Ltd.",https://www.alibaba.com/product-detail/15-6-Inch-Laptop-Intel-Core_1601219718890.html
Hot Selling 15.6 Inch 16G 512GB Quad Core OfficeLaptopwith Intel N95 Cheap PC Computer,US$149.52-US$194.02,"Shenzhen DreamQ Technology Development Co., Ltd.",https://www.alibaba.com/product-detail/Hot-Selling-15-6-Inch-16G_1600489899737.html
Double Touch Screen Notebook Portable Computer 15.6 InchLaptopPc Inter N5095 CPU 16/32G+128/512/1TBLaptop,US$153.62,"ABELOE (HK) TECHNOLOGY CO., LIMITED",https://www.alibaba.com/product-detail/Double-Touch-Screen-Notebook-Portable-Computer_1601348971422.html
Brand NewLaptopPC 15.6 Inch Factory Selling Mini GamingLaptopComputer Student HID Screen LearningLaptopsNotebook Compute,US$185-US$199,"Shenzhen Kingyard Technology Co., Ltd.",https://www.alibaba.com/product-detail/Brand-New-Laptop-PC-15-6_1600828619228.html
First Class MI Air 12 Super Thin Portable 12 Inch Core M3 CPU BusinessLaptop,US$70-US$90,"Shanghai Qiyu Education Technology Co., Ltd.",https://www.alibaba.com/product-detail/First-Class-MI-Air-12-Super_1601362758110.html
"For HP EliteBook 1030G3 X360 Intel Core I5-8 Gen 8G 256GB SSD 13.3"" Computer Notebook Touch",US$250,"Shenzhen Runyi Technology Co., Ltd.",https://www.alibaba.com/product-detail/For-HP-EliteBook-1030G3-X360-Intel_1601114242566.html
