Title,Price,Company,Link
Lenovo Legion R7000 R7-7840 16GB 512GB 8GB-RTX4060 Pc GamingLaptopComputer with 144Hz 15.6inch IPS Screen,"US$1,011","Beijing Yike Century Technology Co., Ltd.",https://www.alibaba.com/product-detail/Lenovo-Legion-R7000-R7-7840-16GB_1601220663327.html
Factory Wholesale 15.6-inch N5095LaptopsStudentLaptopsBusinessLaptops,US$99.70-US$103.80,"Shenzhen Lightning E-Commerce Co., Ltd.",https://www.alibaba.com/product-detail/Factory-Wholesale-15-6-inch-N5095_1601366663930.html
"for hp High cost performance usedlaptop, factory direct sales 12G-1TSSD 640G4 i5-7th thin metallaptopFor image processing",US$180,Guangzhou City Tianhe District Shipai Changle Digital Products Management Department,https://www.alibaba.com/product-detail/for-hp-High-cost-performance-used_1601378497077.html
OEM Factory's Dual Screen Notebook Core I7-10750H Processor 16 Inch + 14 Inch 2K Touch ScreenLaptopfor Business New Camera,US$80-US$500,"HOPESTAR CO., LTD",https://www.alibaba.com/product-detail/OEM-Factory-s-Dual-Screen-Notebook_1601389042784.html
Dell Latitude E7440 UsedLaptopI7-4600U RAM 8GB 256GSSD WIFI 14 INCH TOUCHSCREE WIFI RJ-45 CAMERA BUSINESSLAPTOP,US$148,Guangzhou City Tianhe District Shipai Tiwen Computer Business Department,https://www.alibaba.com/product-detail/Dell-Latitude-E7440-Used-Laptop-I7_1601414251223.html
LaptopsBrand New 15.6 Inch T156-N5095 1920*1080 IPS LPDDR4 12GB SSD 128GB M.2 2280 SATA Win10/11 Notebooks for Work,US$126,"Mildtrans Industrial Co., Limited",https://www.alibaba.com/product-detail/Laptops-Brand-New-15-6-Inch_1601386607989.html
I7 Core Generation Gen 15.6 InchLaptop16GB RAM 1TB SSD IntelLaptopsI7,US$309,"Hanxuanmo (tianjin) Technology Development Co., Ltd.",https://www.alibaba.com/product-detail/I7-Core-Generation-Gen-15-6_1601345113829.html
Best Selling for Dell Inspiron 15 Pro 3530Laptop15.6inch 13th Gen I5-1335U I7-1355U 8gb 16gb 512gb Ssd Notebook Pc,US$699-US$899,"Zhengzhou Huiguo Electronic Technology Co., Ltd.",https://www.alibaba.com/product-detail/Best-Selling-for-Dell-Inspiron-15_1600920511579.html
Brand New HL140S 2 in 1LaptopTablet 14 Inch Touch Screen Intel N95 16GB RAM 512GB 1TB SSD Notebook PCLaptopfor Business Home,US$231.30-US$302.40,"Guangzhou Yixi Technology Co., Ltd.",https://www.alibaba.com/product-detail/Brand-New-HL140S-2-in-1_1601310840753.html
Intel 12th Gen Core I5LaptopI5-1235UL 1920*1080 8GB RAM 512GB SSD Desktop Computers Portable Home BusinessLaptop15.6 Inch,US$265,"Kiso Innovations Technology Co.,ltd",https://www.alibaba.com/product-detail/Intel-12th-Gen-Core-I5-Laptop_1601276955787.html
LaptopComputer 16GB RAM 512GB Can Update 1TB SSD 16GB 15.6 Inch Intel Metal NotebookLaptop,US$155.80,"Jingjiang Gisen Technology Co., Ltd.",https://www.alibaba.com/product-detail/Laptop-Computer-16GB-RAM-512GB-Can_1601308217804.html
High-Performance Lenovo GeekPro G5000 Inter Core I7-13650H 16GB 512GB RTX4050 15.6inch 144Hz Esports GamingLaptopComputer,US$944,"Beijing Yike Century Technology Co., Ltd.",https://www.alibaba.com/product-detail/High-Performance-Lenovo-GeekPro-G5000-Inter_1601220576475.html
Customized 15.6 Inch Notebook Win11 PRO Computadora Portatil Celeron N5095 RAM 16GB 1TB SSD NewLaptopComputer Support I 5 I 7,US$115-US$130,"Shenzhen Great I-Del Technology Co., Ltd.",https://www.alibaba.com/product-detail/Customized-15-6-Inch-Notebook-Win11_1601158058703.html
Dells Computer 14 15 3530Laptop15.6inch 13th Gen I5-1334U 16gb 512gb Ssd Notebook Pc,US$490-US$880,"Shenzhen Kaiwen Boyu Technology Co., Ltd.",https://www.alibaba.com/product-detail/Dells-Computer-14-15-3530-Laptop_1601265656067.html
High-Performance 13.3 Inch Multifunctional Intel HD Graphics Quad Core Notebook 830G5 I5-8TH-8GRAM-256GSSD BusinessLaptops,US$156,Guangzhou City Tianhe District Shipai Changle Digital Products Management Department,https://www.alibaba.com/product-detail/High-Performance-13-3-Inch-Multifunctional_1601420059324.html
Factory Wholesale Newest Android Smart Gaming Tablets Pc GamingLaptops5G WiFi Enabled 12GB+512GB 11inch Computer for Business,US$41.90,"Dongguan Hecheng Interactive Technology Co., Ltd.",https://www.alibaba.com/product-detail/Factory-Wholesale-Newest-Android-Smart-Gaming_1601208033839.html
"15.6\"" + 7\"" Dual Screen BusinessLaptopTouch Screen 16GB RAM 2TB SSD Intel N100 Quad Core Custom Plugs English Keyboard",US$243.89-US$264.67,"Yijin Intelligent Technology (shenzhen) Co., Ltd.",https://www.alibaba.com/product-detail/15-6--7-Dual-Screen_1601297176133.html
DELL 2024 New CheapLaptopCore I5 16GB RAM 512GB 15.6 Inch WholesaleLaptopsLaptopsBrand New,US$579.60,"Henan Province hemumu trading Co. , LTD",https://www.alibaba.com/product-detail/DELL-2024-New-Cheap-Laptop-Core_1601172844239.html
Customized 15.6 Inch Notebook Win11 RAM 16GB 1TB SSDLaptopComputer Support I7 I9,US$233.84-US$307.58,"Jinan Guanshun Electronic Technology Co., Ltd",https://www.alibaba.com/product-detail/Customized-15-6-Inch-Notebook-Win11_1601267274761.html
Katana 15 GamingLaptop15.6'' FHD IPS 144Hz 12th Gen Intel 10-Core I7-12650H 4.7Ghz GeForce RTX 4070 4GB Memory Computer,"US$1,300","Changsha Huanlong Technology Co., Ltd.",https://www.alibaba.com/product-detail/Katana-15-Gaming-Laptop-15-6_11000021999072.html
FactoryLaptop128 256 512gb 1TB SSD 14-inch N3350 PortableLaptopBusiness StudentLaptops,US$122.57,"Hanxuanmo (tianjin) Technology Development Co., Ltd.",https://www.alibaba.com/product-detail/Factory-Laptop-128-256-512gb-1TB_1601359343260.html
15.6 Inch I5-1135G7 Core 11th GenLaptopwith Quad Core 16GB RAM 1TB SSD Intel Metal Notebook UK/AU/EU/US Plug,US$324-US$378,"Shenzhen Honlin Technology Co., Ltd.",https://www.alibaba.com/product-detail/15-6-Inch-I5-1135G7-Core_1601209931432.html
Hot 15.6 Inch2gb 32GB CheapestLaptopNotebook Intel N4000 8GB 128GBLaptopComputer with Win 10 OS Free Shipping,US$110,"Shenzhen Bestviewtech Electronics Co., Ltd.",https://www.alibaba.com/product-detail/Hot-15-6-Inch2gb-32GB-Cheapest_60803993817.html
Lenovo Xiaoxin Pro 16 2023LaptopAmd R7 7735hs Ultrabook 16g/32g Ram 1t Ssd 16-inch 2.5k 120hz Ips Full Screen Notebook,US$850-US$950,"Zhengzhou Huiguo Electronic Technology Co., Ltd.",https://www.alibaba.com/product-detail/Lenovo-Xiaoxin-Pro-16-2023-Laptop_1600806613191.html
Wholesale X60 Core Duo OriginalLaptops12 Inch Low PriceLaptopCore I5 I7 Notebook Computer,US$55-US$85,"Longdake (shenzhen) Technology Co., Ltd.",https://www.alibaba.com/product-detail/Wholesale-X60-Core-Duo-Original-Laptops_1600235961991.html
LaptopNotebook 15.6 Inch Win10/11 Ram 16gb CheapLaptopSupport 128/512gb Ssd Computadora Portatil I5 I7 I9 Level CpuLaptops,US$84.50-US$179,"Di Xiang Industrial (shenzhen) Co., Ltd.",https://www.alibaba.com/product-detail/Laptop-Notebook-15-6-Inch-Win10_1601386863772.html
In Stock Cheapest Portable Ultrathin 14inch AMD 3020e 4GB 128GBBrand NewLaptopComputer Notebook Ordinateur Portable Students,US$84-US$98,Shenzhen South Digital Limited,https://www.alibaba.com/product-detail/In-Stock-Cheapest-Portable-Ultrathin-14inch_1600782334354.html
"Latest 4-in-1 Touch Screen BusinessLaptopwith 14-inch 360-degree Folding, Learning and Gaming Notebook with 16 RAM and 2TB SSD",US$195-US$327,"Shenzhen Jingchuang Guodu Technology Co., Ltd.",https://www.alibaba.com/product-detail/Latest-4-in-1-Touch-Screen_1601369654220.html
Brand NewLaptopN5095 TouchLaptopwith 13.5 Inch 2.5K Screen RAM 12GB BusinessLaptop,US$188-US$269,"HK L&P TECHNOLOGY CO., LIMITED",https://www.alibaba.com/product-detail/Brand-New-Laptop-N5095-Touch-Laptop_1601062589806.html
OEM GamingLaptopwith I3 I5 I7 I9 10th 11th 12th Generation Intel Processors 16GB Memory UK Plug for Games and Design,US$530,"Shenzhen T.d.s Electronic Technology Co., Limited",https://www.alibaba.com/product-detail/OEM-Gaming-Laptop-with-I3-I5_1601042453120.html
Brand New Notebook 14 Inch Win 11 N3350 2.4Ghz DDR3 6GB RAM 64GB ROM and HD ScreenLaptopComputer Not RefurbishedLaptops,US$69-US$110,"Shenzhen Fuli Technology Co., Ltd.",https://www.alibaba.com/product-detail/Brand-New-Notebook-14-Inch-Win_1600795706552.html
Wholesale OEM 14.1 Inch StudentLaptopPc Computer Business Notebook Brand New Personal HomeLaptopsCheapLaptops,US$163-US$179,"ABELOE (HK) TECHNOLOGY CO., LIMITED",https://www.alibaba.com/product-detail/Wholesale-OEM-14-1-Inch-Student_1601275471730.html
15.6 InchLaptopPC Intel Corei5 I7 8GB Ddr4 RAM 256GB SSD Optional Notebook Computer Factory OEM,US$139-US$229,"Shenzhen Itzr Technology Co., Ltd.",https://www.alibaba.com/product-detail/15-6-Inch-Laptop-PC-Intel_1600128163121.html
2-in-1 11.6-Inch Touch ScreenLaptopwith 360 Rotating 8GB RAM 512GB SSD Intel Processor Popular N4020 Notebook,US$181.50-US$181.60,"Shenzhen Peideluo E-Commerce Co., Ltd.",https://www.alibaba.com/product-detail/2-in-1-11-6-Inch_1601294152788.html
For Order EliteBook 830 G6LaptopCore I5 I7 CPU 8th Gen 13 Inch BusinessLaptops,US$190-US$320,"Shanghai Qiyu Education Technology Co., Ltd.",https://www.alibaba.com/product-detail/For-Order-EliteBook-830-G6-Laptop_1601360196913.html
Factory Direct New 8GB 128GB 2 in 1 TabletLaptopPC 10 Inch IPS for Win Tablet PC Win 10/Win 11,US$115.88-US$158.88,"Shenzhen CWHT Technology Co., Ltd.",https://www.alibaba.com/product-detail/Factory-Direct-New-8GB-128GB-2_1600499028516.html
2025 Hot Wholesale OEM 14 Inch FHD Thin Win10 ProLaptopN4000 Quad Core 2.0Ghz Like I5 Portatil Ddr4 8GB SSDLaptopNotebook,US$119.80,Shenzhen Xingzegao Electronics Ltd.,https://www.alibaba.com/product-detail/2025-Hot-Wholesale-OEM-14-Inch_1601386807214.html
14 Inch IPS 1280*800 CheapLaptopSlimLaptopfor Student,US$139,"Shenzhen Greenwell  Technology Co., Ltd.",https://www.alibaba.com/product-detail/14-Inch-IPS-1280-800-Cheap_62500270106.html
Original High Performance Lenovo BusinessLaptopIdeaPad 15s AMD R5-7430U 16GB 512GB 15.6-Inch IPS 60Hz Pc Notebook Computer,US$450-US$500,"Beijing Yike Century Technology Co., Ltd.",https://www.alibaba.com/product-detail/Original-High-Performance-Lenovo-Business-Laptop_1601299999272.html
LaptopH/p X360 1030 G3 OfficeLaptopI5-8th 8+256 Touch Screen Business Home NotebookLaptop,US$259,"Chongqing Dolan Trading Co., Ltd.",https://www.alibaba.com/product-detail/Laptop-H-p-X360-1030-G3_1601250064659.html
2025 Brand New Factory Wholesale N5095LaptopPersonal Home Brand New 16+512gb CheapestLaptopFor Students Office,US$130-US$215,Junsha International Holdings Limited,https://www.alibaba.com/product-detail/2025-Brand-New-Factory-Wholesale-N5095_1601405758363.html
Factory OEM/ODM Easy Connection 13-17inchLaptopsDual 1080P LCD Display NotebookLaptopTriple Screen Monitors,US$169,"Shenzhen Helu Technology Co., Ltd.",https://www.alibaba.com/product-detail/Factory-OEM-ODM-Easy-Connection-13_1601198830153.html
15.6-inch UltrabookLaptop- Ultra-Portable Notebook Computer with Long Battery Life & Fast SSD Storage,US$80,"Shenzhen Aiopc Digital Communication Co., Limited",https://www.alibaba.com/product-detail/15-6-inch-Ultrabook-Laptop-Ultra_1601408559677.html
"Brand New BusinessLaptopsT156-N100 16GB 512GB M.2 2280 SATA SSD with Touch Panel and Backlit Keyboard 15.6"" Notebook Computer",US$175,"Shenzhen Mild-Trans Industrial Co., Ltd.",https://www.alibaba.com/product-detail/Brand-New-Business-Laptops-T156-N100_1601363788106.html
FTL-UTS90 Notebook Color Doppler Portable Best Price Color DopplerLaptopUltrasound Machine Medical Imaging For Animal,"US$1,300-US$1,600","Fatali Medical Technology (foshan) Co., Ltd.",https://www.alibaba.com/product-detail/FTL-UTS90-Notebook-Color-Doppler-Portable_1601305170014.html?s=p
Dixiang Top Wholesale Brand New 14'' Inch Cheapest NewLaptopComputer N3350 4GB Notebook Computer,US$94,"Di Xiang Industrial (shenzhen) Co., Ltd.",https://www.alibaba.com/product-detail/Dixiang-Top-Wholesale-Brand-New-14_1600934563922.html
2+64GB Android 12.0 Fully Sealed Smart WiFi Projector 1080P 4K Full HD Screen Projector 1200 ANSI Lumen Home Theater Beamer,US$156,Shenzhen Smartcn Technology Limited,https://www.alibaba.com/product-detail/2-64GB-Android-12-0-Fully_1601447458638.html?s=p
Best Price NewLaptop15.6 Inch 16GB RAM 256GB SSD Celeron N5095 Win 10 BusinessLaptopNotebook Computer,US$175-US$219,Shenzhen Reborn Technology Company Limited,https://www.alibaba.com/product-detail/Best-Price-New-Laptop-15-6_1600347534265.html
Mini Industrial PC 12th Gen Intel Core I3 I5 I7 Cheap Cloud Solution with AU US CN EU Plugs,US$99.99-US$159.99,Shenzhen Yiyun Electronic Limited Company,https://www.alibaba.com/product-detail/Mini-Industrial-PC-12th-Gen-Intel_11000019593140.html?s=p
2025 Hot Wholesale Intel Core N5095 Business 16GB+256GBLaptops15.6 Inch Notebook for Business Portable Notebook,US$178,Shenzhen Xingzegao Electronics Ltd.,https://www.alibaba.com/product-detail/2025-Hot-Wholesale-Intel-Core-N5095_1601386774827.html
"Home Theater Projector HD 1080P 1000ANSI Lumens 4.45"" LCD Auto Focus WiFi BT 5.0 4K Support Android 12 Projectors Office Class",US$125,Shenzhen Smartcn Technology Limited,https://www.alibaba.com/product-detail/Home-Theater-Projector-HD-1080P-1000ANSI_1601448269219.html?s=p
16inchLaptop16gb Ram 2TB Intel Notebook N95 Computadora Portatil Ordinateur PortableLaptopComputerLaptops,US$185-US$198,"Shenzhen Vocca Electronics Co., Ltd.",https://www.alibaba.com/product-detail/16inch-Laptop-16gb-Ram-2TB-Intel_1600990530969.html
DW-L3 Basic Version OfLaptopColor Doppler Ultrasound Scanner,"US$2,199-US$5,299","Dawei Medical (Jiangsu) Co., Ltd.",https://www.alibaba.com/product-detail/DW-L3-Basic-Version-Of-Laptop_1601443132241.html?s=p
Laptop15.6Inch Intel UHD Graphics N5095LaptopComputer Keyboards Backlight BusinessLaptops,US$149-US$233,"Guangzhou Allison Technology Co., Ltd.",https://www.alibaba.com/product-detail/Laptop-15-6Inch-Intel-UHD-Graphics_1601336651045.html
4.45inch LCD 1080P Projector 1000ANSI 4k 8k Video Support Auto Focus Keystone HD USB For Home/Movie/Office/Classroom Android 12,US$125,Shenzhen Smartcn Technology Limited,https://www.alibaba.com/product-detail/4-45inch-LCD-1080P-Projector-1000ANSI_1601447970302.html?s=p
Original Brand New New Design 15.6 + 7 Inch SlimLaptopComputers With Touch Screen Notebook ComputerLaptop,US$233.24-US$272.44,"Shenzhen Gst Communication Co., Ltd",https://www.alibaba.com/product-detail/Original-Brand-New-New-Design-15_1601052801276.html
DW-580 Best Seller PlasticLaptopUltrasonic Scanner Equipment CE & ISO Certified Black/White Basic Color,"US$950-US$1,999","Dawei Medical (Jiangsu) Co., Ltd.",https://www.alibaba.com/product-detail/DW-580-Best-Seller-Plastic-Laptop_1601433769840.html?s=p
Super Cheap 14.1 Inch BrandLaptopsJ4125 8GB RAM SSD Optional NewLaptopsfor Home & Business and WorkingLaptopComputers,US$155-US$240,"Shenzhen Honlin Technology Co., Ltd.",https://www.alibaba.com/product-detail/Super-Cheap-14-1-Inch-Brand_1601209370106.html
"15""LED Trolley Diagnostic System Best Price Ultrasonic Ultrasound Machine Factory",US$100,"Xuzhou Forward Medical Instrument Co., Ltd.",https://www.alibaba.com/product-detail/15-LED-Trolley-Diagnostic-System-Best_60601568043.html?s=p
2024 Low Price Brand New Brand N95 15.6-inch Win 11Laptop16/32GB RAM ROM Personal and Home Learning and EducationLaptops,US$159.60-US$194.75,"Hanxuanmo (tianjin) Technology Development Co., Ltd.",https://www.alibaba.com/product-detail/2024-Low-Price-Brand-New-Brand_1601291939521.html
7 Inch TN HD-MI Suitable For Windows Raspberry Linux Android System BB Black Banana Pi And Other Mainstream Mini PC,US$47,"Beijing DWIN Technology Co., Ltd.",https://www.alibaba.com/product-detail/7-Inch-TN-HD-MI-Suitable_1600814196931.html?s=p
Wholesale I7 Core Business 16GB+1TBLaptops15.6 Inch for Business Portable Notebook,US$298.59,"Hanxuanmo (tianjin) Technology Development Co., Ltd.",https://www.alibaba.com/product-detail/Wholesale-I7-Core-Business-16GB-1TB_1601294155110.html
New One Touch Functions High Boron Glass Visualization 4.5 Quart Oilless Air Fryer,US$30.50-US$33.50,"Handinhand (Zhejiang) Electronic Commerce Co., Ltd.",https://www.alibaba.com/product-detail/New-One-Touch-Functions-High-Boron_1600432513808.html?s=p
China Cheapest N4000 14-inch Core BusinessLaptopUltra Slim GamingLaptopPersonal & Home Study EducationLaptop,US$123-US$128,"Hanxuanmo (tianjin) Technology Development Co., Ltd.",https://www.alibaba.com/product-detail/China-Cheapest-N4000-14-inch-Core_1601420826099.html
Scientific Calculator Logo Digital Professional Students Mathematics Fx 991es Plus Custom Solar Electronic Scientific Calculator,US$3.25-US$3.99,"Guangzhou Cania Technology Co., Limited",https://www.alibaba.com/product-detail/Scientific-Calculator-Logo-Digital-Professional-Students_1600579283501.html?s=p
US Warehouse 15.6Inch 16GB+512GB Intel N5095 5000mAH WholesaleLaptopComputer Ordinateur Portable Core 5 BusinessLaptop,US$178,Shenzhen Xingzegao Electronics Ltd.,https://www.alibaba.com/product-detail/US-Warehouse-15-6Inch-16GB-512GB_1601386775910.html
Wholesale Factory Price B/W Ultrasound Scanner Imaging System 4D Black White Ultrasound Machine With Trolley,"US$1,400","Guangzhou Anton Medical Technology Co., Ltd.",https://www.alibaba.com/product-detail/Wholesale-Factory-Price-B-W-Ultrasound_1600868607491.html?s=p
"New BusinessLaptopNuevo 15.6""+7"" Dual Touch Screen 180 Degree Opening Win 11 Intel N95 Backlight Keyboard Double ScreenLaptop",US$233-US$278,"Guangzhou Yixi Technology Co., Ltd.",https://www.alibaba.com/product-detail/New-Business-Laptop-Nuevo-15-6_1600970974716.html
DW-690 Dual Probe InterfaceLaptopUltrasound System Black And White With Metal And Plastic Materials Electric Power Source,"US$1,300-US$3,000","Dawei Medical (Jiangsu) Co., Ltd.",https://www.alibaba.com/product-detail/DW-690-Dual-Probe-Interface-Laptop_1601438829457.html?s=p
15.6-Inch Business Notebook with Core I3 I5 I7 I9 Windows 11 PRO Wireless English Keyboard NewLaptopfor Business Use,US$391-US$539,"Guangzhou Allison Technology Co., Ltd.",https://www.alibaba.com/product-detail/15-6-Inch-Business-Notebook-with_1601379171867.html
2 X MCIO 8i with 4 X Gen5 NVMe AMD 9004/9005 PCIe 5.0 X 16 Slots Dual-socket Workstation Server,"US$1,600-US$1,800","Shenzhen Telefly Telecommunications Equipment Co., Limited",https://www.alibaba.com/product-detail/2-X-MCIO-8i-with-4_1601379992814.html?s=p
Original Brand New New Design 15.6 + 7 Inch SlimLaptopComputers With Touch Screen Notebook ComputerLaptop,US$217-US$275,"Hanxuanmo (tianjin) Technology Development Co., Ltd.",https://www.alibaba.com/product-detail/Original-Brand-New-New-Design-15_1601408700029.html
"FTL-UTS100 Notebook Color Doppler PortableLaptopUltrasound Machine Medical Imaging For Pet 15"" HD Display","US$1,500-US$2,000","Fatali Medical Technology (foshan) Co., Ltd.",https://www.alibaba.com/product-detail/FTL-UTS100-Notebook-Color-Doppler-Portable_1601305140728.html?s=p
Factory DirectLaptop128 256 512GB 1TB SSD 14 Inch N3350 DDR3 New Business StudentsLaptopsNotebook for Celeron,US$109-US$126,"Guangzhou Allison Technology Co., Ltd.",https://www.alibaba.com/product-detail/Factory-Direct-Laptop-128-256-512GB_1601336471382.html
Custom Logo Leather A5 Size Business Smart Notebook With Wireless Charger Charging Loose Leaf Journal Gift For Professionals,US$15.30,"Shenzhen Haoheng Leather Goods Co., Ltd.",https://www.alibaba.com/product-detail/Custom-Logo-Leather-A5-Size-Business_1600978164733.html?s=p
BusinessLaptopWith 512GB 1TB SSD 15.6-Inch IPS Display Notebook for Business 11th Generation,US$159.60-US$194.75,"Hanxuanmo (tianjin) Technology Development Co., Ltd.",https://www.alibaba.com/product-detail/Business-Laptop-With-512GB-1TB-SSD_1601266581292.html
"Crucial X9 Portable SSD 1TB 2TB For PC And Mac, Lightweight And Small With USB 3.2 External Solid State Drive",US$65-US$110,"Shenzhen Tianteng Digital Technology Co., Ltd.",https://www.alibaba.com/product-detail/Crucial-X9-Portable-SSD-1TB-2TB_1601437204121.html?s=p
J4105 New Hot Wholesale 14.1-Inch Slim Notebook 4000mAhLaptopPC with Win11 Cheap Netbook Mini Computer for Personal & Home Use,US$130-US$165,"Shenzhen Huashengtai Technology Co., Ltd.",https://www.alibaba.com/product-detail/J4105-New-Hot-Wholesale-14-1_1601034427603.html
New Original HPE ProLiant Dl360 DL380 Gen10 Plus Gen11 Intel Xeon GPU 2U Rack Chassis System Data Center Virtual Computer Server,"US$150-US$1,500","Beijing Puhua Haotian Technology Co., Ltd.",https://www.alibaba.com/product-detail/New-Original-HPE-ProLiant-Dl360-DL380_1601004650299.html?s=p
Dual ScreenLaptop15.6 Inch + 7 Inch Touch Screen Intel N100 Processor GamingLaptopNotebook Computer BusinessLaptop,US$220-US$310,"Shenzhen Vocca Electronics Co., Ltd.",https://www.alibaba.com/product-detail/Dual-Screen-Laptop-15-6-Inch_1601000850099.html
FX-991MS Scientific Calculator FX-100MS Engineerig Customized Student Calculate Cientifica Calculadora Calculator Scientific,US$1.49-US$2,"Guangzhou Cania Technology Co., Limited",https://www.alibaba.com/product-detail/FX-991MS-Scientific-Calculator-FX-100MS_1600332141971.html?s=p
"2025 New Hot Sale Brand New 14\""-15.6\"" InchLaptopPC Win 10 Intel 8GB RAM 128GB-256GB-1024GB-1TB SSD 1TB Inventory Price",US$128.68,"Shenzhen Chaowu Technology Co., Ltd.",https://www.alibaba.com/product-detail/2025-New-Hot-Sale-Brand-New_1601372385490.html
Used Sirona XG 3D Dental Panoramic Machine Digital Cbct 3D,"US$14,200-US$16,600","Guangzhou Happycare Medical Equipment Co., Ltd.",https://www.alibaba.com/product-detail/Used-Sirona-XG-3D-Dental-Panoramic_1601440382781.html?s=p
Hot Selling New 14.1 Inch 16Gb+512Gb Wifi6 Gaming Business Office PersonalLaptopGamingLaptop,US$120,"Shenzhen Huashengtai Technology Co., Ltd.",https://www.alibaba.com/product-detail/Hot-Selling-New-14-1-Inch_1601290868697.html
Le-novo ThinkServer SR660 V2 Rack Mounted Server 2x Intel Xeon Silver 4316 40 Cores/128GB 16GB+64GB HDD Three Years Warranty,"US$2,500","Jinma Group (China) Co., Limited",https://www.alibaba.com/product-detail/Le-novo-ThinkServer-SR660-V2-Rack_1601398865762.html?s=p
Brand new Custom logolaptopsnotebook N100 16GB DDR4 512GB SSD Ultra Thin 15.6+7inch Double screenlaptopcomputer,US$248,"Shenzhen Gst Communication Co., Ltd",https://www.alibaba.com/product-detail/Brand-new-Custom-logo-laptops-notebook_1601397471215.html
FTL-UTS60 Notebook B/W Ultrasound Cheap Digital HandheldLaptopPortable Ultrasound Machine One Probe Socket For Animals,US$500-US$900,"Fatali Medical Technology (foshan) Co., Ltd.",https://www.alibaba.com/product-detail/FTL-UTS60-Notebook-B-W-Ultrasound_1601304621580.html?s=p
Factory Direct 14 Inch N3350 Notebook New BusinessLaptopswith 128/256/512GB 1TB SSD DDR3 for Students and Professionals,US$109-US$126,"Guangzhou Allison Technology Co., Ltd.",https://www.alibaba.com/product-detail/Factory-Direct-14-Inch-N3350-Notebook_1601381709840.html
Best Selling Business Mini Desktop Computer Intel N100 N150 DDR5 16GB M.2 Hard Drive 250GB N100 Mini 32GB Industrial Computer,US$149-US$399,"FAS Technology Co., Ltd.",https://www.alibaba.com/product-detail/Best-Selling-Business-Mini-Desktop-Computer_1601434178556.html?s=p
2025 14.1-InchLaptopN4000 with 6GB/1TB RAM 1920*1080 IPS Screen WIN 11 Operating System for Personal Home & Educational,US$109,"Hanxuanmo (tianjin) Technology Development Co., Ltd.",https://www.alibaba.com/product-detail/2025-14-1-Inch-Laptop-N4000_1601266311927.html
Original Win 11 Pro USB Full Package Online Activation Win 11 Pro Retail USB Box Win 11 Pro Box Guaranteed Fast Shipping,US$17,"Guangzhou Chengqi Technology Co., Ltd.",https://www.alibaba.com/product-detail/Original-Win-11-Pro-USB-Full_1601395380895.html?s=p
China 14.1-Inch N4000 BusinessLaptopPortable Lightweight All-In-One Office Student Education English for Personal Home Use,US$124-US$128,"Hanxuanmo (tianjin) Technology Development Co., Ltd.",https://www.alibaba.com/product-detail/China-14-1-Inch-N4000-Business_1601382939916.html
10.4/12.1/13.3/15/15.6/17/18.5/19/21.5/23.6/27 Inch Touch Panel Core I5/4G/64G All-in-one Industrial Touchscreen Computer,US$332-US$504,"Guangzhou Baochuang Electronic Technology Co., Ltd.",https://www.alibaba.com/product-detail/10-4-12-1-13-3_1600800252813.html?s=p
15.6 Inch Intel I9 11900H Portable BusinessLaptopNew 16GB RAM 1TB SSD for Personal Use,US$459,"Shenzhen Honlin Technology Co., Ltd.",https://www.alibaba.com/product-detail/15-6-Inch-Intel-I9-11900H_1601323540319.html
Periodmed Factory Price Portable Handheld Doppler Ultrasound Wireless Handheld Ultrasound Machine,"US$1,400-US$1,800","Jiangsu Periodmed Science Technology Co., Ltd.",https://www.alibaba.com/product-detail/Periodmed-Factory-Price-Portable-Handheld-Doppler_1601256556198.html?s=p
"15.6\"" BusinessLaptopIntel Processors Custom Portable Metal English DDR4 256GB 512GB 128GB 2TB WiFi 1TB 7 Inch",US$243.89-US$357.51,"Yijin Intelligent Technology (shenzhen) Co., Ltd.",https://www.alibaba.com/product-detail/15-6-Business-Laptop-Intel-Processors_1601297004884.html
New Machine Mitsubishi Video Thermal Doppler Cable Prices Paper Manufacturer Best 3D Color Scan Ultrasound Printers,US$300-US$600,"Hunan Zetop Medical Co., Ltd.",https://www.alibaba.com/product-detail/New-Machine-Mitsubishi-Video-Thermal-Doppler_1600260574099.html?s=p
2024 MIini 13.5 + 13.5 Inch 2 in 1LaptopDual Screen Touch Screen NewLaptopfor Portable,US$360-US$469,"Shenzhen Chxk Technology Co., Ltd.",https://www.alibaba.com/product-detail/2024-MIini-13-5-13-5_1601038239365.html
Best Price C320 DC AC With Test Video Mini OLTS Zxa10 C320 GTGH C++ GTGO Ftth Olts 10G 1G 2slots Gpon Epon OLT,US$404.10-US$598.90,"Guangzhou Qiton Electronics Technology Co., Ltd.",https://www.alibaba.com/product-detail/Best-Price-C320-DC-AC-With_1600623058925.html?s=p
Low Price N4000 14-inchLaptop256GB 1TB Ultra Slim Gaming Personal & Home Learning Education OfficeLaptops,US$124.20-US$162,"Hanxuanmo (tianjin) Technology Development Co., Ltd.",https://www.alibaba.com/product-detail/Low-Price-N4000-14-inch-Laptop_1601279953617.html
