Title,Price,Company,Link
Winson All in One Point of Sale Cash Register Machine Android Touch Screen POS Terminal POS Systems,US$158.40,"Guangzhou Winson Information Technology Co., Ltd.",https://www.alibaba.com/product-detail/Winson-All-in-One-Point-of_1600437866343.html?s=p
"15.6\"" 13th Gen Intel N95 BusinessLaptopUltra-Thin 1920X1080IPS Case 8G DDR 128GB-1TB SSD Wireless 15.6 Inch BusinessLaptop",US$170-US$287,"Shenzhen Vocca Electronics Co., Ltd.",https://www.alibaba.com/product-detail/15-6-13th-Gen-Intel-N95_1601002244525.html
Full Set of Retail Single Screen Point of Sale Supermarket Pos System All in One Machine Cash Register,US$30-US$440,"Sunson Iot  (xiamen) Technology Co., Ltd.",https://www.alibaba.com/product-detail/Full-Set-of-Retail-Single-Screen_1600899725717.html?s=p
BusinessLaptopBag 15.6 for HP Dell ASUS Macbook Zipper Front AccessoriesLaptopBriefcase Case Bag Sleeve Business Men Women,US$5.60,"Guangzhou Maplestory Case Co., Ltd.",https://www.alibaba.com/product-detail/Business-Laptop-Bag-15-6-for_60835488772.html
Wide Viewing Angle Portable Ultrasound Diagnostic System Scanner Animal Ultrasound Device,US$915,"KAI CHENG INDUSTRIAL CO., LIMITED",https://www.alibaba.com/product-detail/Wide-Viewing-Angle-Portable-Ultrasound-Diagnostic_1601439724662.html?s=p
Computer Business OfficeLaptopBag for Men Price in DollarsLaptopHandbag High Quality,US$4.55,"Shenzhen Youhui Electronics Co., Ltd.",https://www.alibaba.com/product-detail/Computer-Business-Office-Laptop-Bag-for_1601187499315.html
15.6 Inch Dual Touch Screen Computer POS System Machine Monitor Win 7 10 All in One POS Terminals,US$30-US$440,"Sunson Iot  (xiamen) Technology Co., Ltd.",https://www.alibaba.com/product-detail/15-6-Inch-Dual-Touch-Screen_1600939717293.html?s=p
"Redmi Book 14 2024 I5-13500H Integrated Graphics, Lightweight, Office notebook, High-performance",US$555-US$625,"Chengdu Chenxuan Communication Equipment Co., Ltd.",https://www.alibaba.com/product-detail/Redmi-Book-14-2024-I5-13500H_1601395383304.html
LHWN50 Multi-function Ultrasound System Animals Full Digital Ultrasonic Diagnostic Device PortableLaptopVet Ultrasound,"US$803-US$1,270","Shenzhen Lohas Medical Devices Co., Ltd.",https://www.alibaba.com/product-detail/LHWN50-Multi-function-Ultrasound-System-Animals_1600721716312.html?s=p
High Quality OEM NotebookLaptop15.6 Inch 16GB+512GB I5 I7 I9 New OEM for Educational Business and Home,US$178,Shenzhen Xingzegao Electronics Ltd.,https://www.alibaba.com/product-detail/High-Quality-OEM-Notebook-Laptop-15_1600243909470.html
65inch Waterproof Tempered Glass Lcd Indoor Touch Screen Table All In One Pc Touch Interactive Smart Table,US$550-US$800,"Shanghai Zhuxin Intelligent Technology Co., Ltd.",https://www.alibaba.com/product-detail/65inch-Waterproof-Tempered-Glass-Lcd-Indoor_1601444099378.html?s=p
New Mini Portable PC1068Laptop10.1 Inch Win 10 N3350+IPS+2G+32G Pink Color Notebook with English Keyboard Cheap Portable,US$70,"Shenzhen Honlin Technology Co., Ltd.",https://www.alibaba.com/product-detail/New-Mini-Portable-PC1068-Laptop-10_1600869677541.html
MFG Direct Selling Flash Pro Ultra Power Bank 25000mAh 140W Fast Charging 289.5W Power Bank With OLED Screen,US$69-US$89,"Shenzhen TDE Technology Co., LTD.",https://www.alibaba.com/product-detail/MFG-Direct-Selling-Flash-Pro-Ultra_1601377803608.html?s=p
LaptopBag Case for Macbook Air Pro 13 14 15.6 Xiaomi Lenovo Asus Dell HP Notebook Sleeve 13.3 Inch Protective Case Black Grey,US$3.29,"Shenzhen Anryque Technology Co., Ltd.",https://www.alibaba.com/product-detail/Laptop-Bag-Case-for-Macbook-Air_1601268481503.html
YPOO New Large Slope -6-+46% Auto Incline Home Treadmill Gym Fitness Equipment Semi Commercial Treadmill With App,US$399-US$539,"Zhejiang Ypoo Health Technology Co., Ltd.",https://www.alibaba.com/product-detail/YPOO-New-Large-Slope-6-46_1601380592791.html?s=p
2024 13.5 Inch Dual Touch Screen 2.5K 2256*1504 ResolutionLaptopN100 DDR5 16G 12Gen 9000 BatteryLaptopPc,US$349.20,"Shenzhen DreamQ Technology Development Co., Ltd.",https://www.alibaba.com/product-detail/2024-13-5-Inch-Dual-Touch_1601016065059.html
Diesel Generator Sets 10kva 15kva 20kva 40kva 60kva 80kva 100kva Super Silent Diesel Generator Diesel Generators For Sale 800KVA,"US$2,500-US$8,000",Jiangsu Mado Engineering Ltd.,https://www.alibaba.com/product-detail/Diesel-Generator-Sets-10kva-15kva-20kva_1601358155125.html?s=p
New GamingLaptopI9 12900H RTX4060 8G 12GEN Notebook Computer 64G 1TB High-end GamingLaptop,US$808.20,"Shenzhen DreamQ Technology Development Co., Ltd.",https://www.alibaba.com/product-detail/New-Gaming-Laptop-I9-12900H-RTX4060_1601260567237.html
Fitness Cardio Home Use Electric Semi Commercial Treadmill 18km High Speed Treadmill Running Machine,US$182-US$203,"Zhejiang Ypoo Health Technology Co., Ltd.",https://www.alibaba.com/product-detail/Fitness-Cardio-Home-Use-Electric-Semi_1601367727231.html?s=p
15.6-Inch FHD IPS Display Win10 Notebook Intel Core I5-1135G7 Processor 16GB DDR4 RAM 512GB MetalLaptop,US$360-US$380,"Shenzhen Honlin Technology Co., Ltd.",https://www.alibaba.com/product-detail/15-6-Inch-FHD-IPS-Display_1600520300171.html
YJZN All-In-One 82 83 86 96 102 106 Inch Electronic Interactive Whiteboard For Digital Conferences,US$118,"Shenzhen Yunjiao Intelligent Technology Co., Ltd.",https://www.alibaba.com/product-detail/YJZN-All-In-One-82-83_1601443224923.html?s=p
"NewLaptopScreen Extender 15.6"" Portable Triple Monitor S6 forLaptopup to 17.3"" With IPS FHD 1080PLaptopPortable Monitors",US$299,"Shenzhen Maohongsheng Technology Co., Ltd.",https://www.alibaba.com/product-detail/New-Laptop-Screen-Extender-15-6_1601379180157.html
Hospital MEDICALLaptopVET Ultrasound Instruments Portable Ultrasound Scanner Price Animal Ultrasound Machine,US$850-US$900,"Nanjing Long Medical Technology Co., Ltd.",https://www.alibaba.com/product-detail/Hospital-MEDICAL-Laptop-VET-Ultrasound-Instruments_1601425229532.html?s=p
Cheap SmartLaptopBags High Quality LargeLaptopBackpack Travel Business College Notebook Backpacks Cute Stylish Backpacks,US$3.14,"Ningbo Blueprint Import & Export Co., Ltd.",https://www.alibaba.com/product-detail/Cheap-Smart-Laptop-Bags-High-Quality_1601296592326.html
CE Certified Cheap Diesel Articulated Backhoe Bucket Tractor Loader 4x4 Wheel Loader Backhoe Excavator For Sale,"US$20,999-US$23,699","Shandong Songsheng Heavy Industry Machinery Co., Ltd.",https://www.alibaba.com/product-detail/CE-Certified-Cheap-Diesel-Articulated-Backhoe_1601322162000.html?s=p
Fast Delivery I7 11850H GamingLaptopNVIDIA GTX3070 8GB Graphics Card 16 Inch With High Speed for Gaming Design 3D Cartographic,"US$759-US$8,477","Shenzhen Chxk Technology Co., Ltd.",https://www.alibaba.com/product-detail/Fast-Delivery-I7-11850H-Gaming-Laptop_1601386789392.html
10kva Super Silent Type Standby Power Perkin S Diesel Generator Set,"US$4,575-US$5,075","GB Power Co., Ltd. (Shanghai)",https://www.alibaba.com/product-detail/10kva-Super-Silent-Type-Standby-Power_1600892322933.html?s=p
Factory Direct 14 Inch N3350 Notebook New BusinessLaptopswith 128/256/512GB 1TB SSD DDR3 for Students and Professionals,US$109-US$126,"Guangzhou Allison Technology Co., Ltd.",https://www.alibaba.com/product-detail/Factory-Direct-14-Inch-N3350-Notebook_1601381829204.html
Win 11 Pro USB Box 100% Online Activation Win 11 Pro Box USB Full Package Fast Shipping,US$17,"Guangzhou Hanshun Trade Co., Ltd.",https://www.alibaba.com/product-detail/Win-11-Pro-USB-Box-100_1601434399374.html?s=p
Good Quality AZERTYLaptopPC for French Speaking People Intel Core I9 12th Generation Ethernet RJ45LaptopsAZERTY QWERTY,US$539,"Shenzhen Anxin Taihe Technology Co., Ltd.",https://www.alibaba.com/product-detail/Good-Quality-AZERTY-Laptop-PC-for_1600315542770.html
Original New 6ES7214-1AG40-0XB0 SIMATIC S7-1200 CPU 1214C Compact CPU PLC In Stock,US$200-US$400,"Shanghai Yicheng Automation Technology Co., Ltd.",https://www.alibaba.com/product-detail/Original-New-6ES7214-1AG40-0XB0-SIMATIC_1601295935325.html?s=p
Low Minimum Order Quantity 14-inch BusinessLaptopNew Intel N5095 Processor Quad-core 8G 16G 32 Memory Window 11Laptop,US$115-US$237,"Shenzhen Jingchuang Guodu Technology Co., Ltd.",https://www.alibaba.com/product-detail/Low-Minimum-Order-Quantity-14-inch_1601365992308.html
A5 Journal Notizbuch Linen Personalisierte Notizbucher Und Pens Notizbuch Kariert Logo,US$1.50,"Taizhou Eego Industry And Trade Co., Ltd.",https://www.alibaba.com/product-detail/A5-Journal-Notizbuch-Linen-Personalisierte-Notizbucher_1601439862051.html?s=p
TAIKESEN Water Splashproof Notebook SleeveLaptopCase Bag for Macbook M1 M2 M3 Air Pro HP Huawei LenovoLaptopCover,US$2.90,"Ningbo Yinzhou Suoku Electronic Technology Co., Ltd.",https://www.alibaba.com/product-detail/TAIKESEN-Water-Splashproof-Notebook-Sleeve-Laptop_1601072099647.html
30KVA Silent Diesel Generator,"US$3,000-US$3,120","GB Power Co., Ltd. (Shanghai)",https://www.alibaba.com/product-detail/30KVA-Silent-Diesel-Generator_1600902301210.html?s=p
2024 High QualityLaptop14-inch N4000 Fluid No Latency 1TB Thin & Light Portable Home Office BusinessLaptop,US$113-US$153,"Hanxuanmo (tianjin) Technology Development Co., Ltd.",https://www.alibaba.com/product-detail/2024-High-Quality-Laptop-14-inch_1601297251888.html
Aismartlink Latest product Raspberry Pi 5 Model B 8GB ARM Single Board Computer raspberry pi 5b 4gb,US$60-US$89,"Wuhan Wangling Intelligent Technology Co., Ltd.",https://www.alibaba.com/product-detail/Aismartlink-Latest-product-Raspberry-Pi-5_1600958937589.html?s=p
Ultra GamingLaptopCore I7-1065G7 10th Gen 15.6inch 16GB 512GB 1Tb SSD Win11 Ordinateur Portable Core I7 Game Notebook,US$334,Shenzhen South Digital Limited,https://www.alibaba.com/product-detail/Ultra-Gaming-Laptop-Core-I7-1065G7_1601212705477.html
Original Mindray Ultrasonic Diagnostic Imaging System Scanner Digital Ultrasound,"US$999-US$1,899","Hunan Zetop Medical Co., Ltd.",https://www.alibaba.com/product-detail/Original-Mindray-Ultrasonic-Diagnostic-Imaging-System_1601118525573.html?s=p
2025 New 14 Inch Hot SaleLaptopLarge 128GB 1024GB 1TB Memory 5000Mah Battery Intel Wireless Inventory Clearance Price,US$128.68,"Shenzhen Chaowu Technology Co., Ltd.",https://www.alibaba.com/product-detail/2025-New-14-Inch-Hot-Sale_1601372402388.html
